{
  "created_at": "2026-07-21T08:00:00Z",
  "findings": [
    {
      "check": "REVIEW_STATUS",
      "detail": "客户端已审核，无可见性限制",
      "evidence": {},
      "schema_version": "1",
      "severity": "INFO"
    }
  ],
  "id": "01J2ZK3AC9V6XW8YQ4R5T6U7PF01",
  "method": "OFFICIAL_API",
  "platform": "TIKTOK",
  "publishable": true,
  "schema_version": "1"
}
